Wimpy                                                          ,+27 43 722 2898 ,https://location.wimpy.co.za/east-london-esplanade?y_source=1_MTIzNjA3MTctNzE1LWxvY2F0aW9uLndlYnNpdGU%3D                                                                                   ,         4.2 ,          1664 ,              4.0 ,                 30 ,#32 on            ,"#32 on""Where to eat: the 50 best restaurants in East London""" ,"AboutWimpy is a well-established casual dining spot known for its selection of burgers, mixed grills, and other classic comfort dishes. Situated by the ocean, it offers a serene atmosphere with a refreshing sea breeze. Visitors have praised the friendly staff who go out of their way to assist guests, such as providing access to WiFi for booking transportation. The eatery is lauded for its great service and delicious food, making it an ideal spot for a satisfying breakfast or a filling meal."                                                                               ,https://wanderlog.com/place/details/2801866/wimpy
Panarottis Hemingways                                          ,+27 43 726 2014 ,https://www.panarottis.com/za/restaurants/eastern-cape/panarottis-hemingways/?utm_source=google_maps&utm_medium=website_button&utm_campaign=SP&utm_content=SP                              ,         4.0 ,           335 ,              3.5 ,                 23 ,#40 on            ,"#40 on""Where to eat: the 50 best restaurants in East London""" ,"AboutPanarottis Hemingways is an Italian restaurant located at Hemingways. It offers a wide variety of delicious pizza and pasta made from high-quality ingredients. The restaurant provides a family-friendly environment with an awesome kiddies area where kids can build their own pizzas and decorate their own waffles. The service is known for being friendly and accommodating, making every visitor feel comfortable."                                                                                                                                                               ,https://wanderlog.com/place/details/2943439/panarottis-hemingways
La Cuisinette                                                  ,+27 43 748 3964 ,http://www.lacuisinette.co.za/                                                                                                                                                             ,         4.5 ,           131 ,              4.5 ,                 17 ,#43 on            ,"#43 on""Where to eat: the 50 best restaurants in East London""" ,"AboutThe new location of La Cuisinette is smaller, but it offers a more intimate atmosphere. They were the only ones booked on that particular night, which allowed for excellent service. The food was exquisite, ranging from delicious steak to flavorful tongue. It would have been nice if they had something special for the birthday girl in our group, as this could potentially attract more people to celebrate their birthdays at the restaurant."                                                                                                                                  ,https://wanderlog.com/place/details/3001073/la-cuisinette
Ciao Bella Cafe & Pizzeria                                     ,+27 43 735 1542 ,http://www.ciaobellacafe.co.za/                                                                                                                                                            ,         4.6 ,           296 ,              4.5 ,                 16 ,#27 on            ,"#27 on""Where to eat: the 50 best restaurants in East London""" ,"AboutNestled along Old Transkei Road in Nahoon, Ciao Bella Cafe & Pizzeria is a delightful haven for lovers of authentic Italian cuisine. This charming spot specializes in mouthwatering pizzas, delectable pasta dishes, and scrumptious paninis that are sure to satisfy any craving. Open throughout the week with varying hours, it’s an ideal place for breakfast or a cozy dinner. During my recent visit while passing through town, I stumbled upon this little gem after a quick online search."                                                                                     ,https://wanderlog.com/place/details/893402/ciao-bella-cafe--pizzeria
Brazas Portuguese Fusion                                       ,+27 73 853 9115 ,http://www.brazas.co.za/                                                                                                                                                                   ,         4.8 ,           162 ,              5.0 ,                 15 ,#48 on            ,"#48 on""Where to eat: the 50 best restaurants in East London""" ,"AboutBrazas Portuguese Fusion in East London is making a mark with its unique and vibrant flair, embodying the motto ""Mi Casa Su Casa"" to create a welcoming and homely atmosphere. The restaurant boasts a cozy ambiance with personalized decor and soft lighting, setting the stage for an exceptional dining experience. Blending traditional Portuguese flavors with innovative twists, Brazas offers a delightful and unforgettable culinary journey."                                                                                                                                 ,https://wanderlog.com/place/details/3192635/brazas-portuguese-fusion
Areena Quays Restaurant                                        ,+27 71 720 5867 ,http://www.areenaresort.com/                                                                                                                                                               ,         4.2 ,           532 ,              3.5 ,                 14 ,#45 on            ,"#45 on""Where to eat: the 50 best restaurants in East London""" ,"AboutAreena Quays Restaurant is a family-friendly dining spot with a tranquil environment and plenty of activities for kids. The restaurant offers delicious food and fantastic service, making it an ideal place for a special celebration or a relaxing meal. With its stunning views and serene ambience, Areena Quays Restaurant is the perfect destination for those looking to enjoy an ""All you can eat"" experience while surrounded by nature."                                                                                                                                      ,https://wanderlog.com/place/details/3001098/areena-quays-restaurant
Jade Garden Fusion Restaurant                                  ,+27 63 451 3912 ,https://www.facebook.com/jadegardenfusionrestaurant/                                                                                                                                       ,         4.8 ,           104 ,              5.0 ,                 12 ,#36 on            ,"#36 on""Where to eat: the 50 best restaurants in East London""" ,"AboutJade Garden Fusion Restaurant is a top-rated spot in East London, offering a pleasant and beautiful setting with comfortable seating. The restaurant is known for its marvelous food, and the staff provides great service, making it a rare find in the area. Visitors praise the cleanliness, newness, and appealing decor of the restaurant. The menu features a variety of Chinese dishes that have impressed even those who were previously not fans of certain flavors. Customers can enjoy dine-in or take advantage of the convenient takeaway service."                          ,https://wanderlog.com/place/details/2801923/jade-garden-fusion-restaurant
Key Largo                                                      ,+27 43 707 7985 ,https://www.southernsun.com/southern-sun-hemingways/dining/key-largo?utm_source=google&utm_medium=businesslisting&utm_campaign=rstrnt_key-largo                                            ,         4.3 ,            42 ,              3.5 ,                 10 ,#28 on            ,"#28 on""Where to eat: the 50 best restaurants in East London""" ,"AboutKey Largo, located at Hemingways Hotel, offers a diverse selection of dishes from the grill buffet and a la carte menu. The restaurant boasts stunning views of the beautiful gardens and is open for breakfast, lunch, and dinner. Guests have praised the exquisite food and excellent service, making it an unforgettable dining experience. The buffet on Friday nights is particularly popular for its delicious offerings. Chef Shaun Gibb's culinary skills have been highlighted as exceptional, adding to the restaurant's appeal."                                              ,https://wanderlog.com/place/details/893406/key-largo
Elahleni Food and Braai                                        ,+27 78 726 8835 ,https://elahleni.co.za/                                                                                                                                                                    ,         4.3 ,           304 ,              4.0 ,                  1 ,#47 on            ,"#47 on""Where to eat: the 50 best restaurants in East London""" ,"AboutElahleni Food and Braai offers a variety of experiences to its customers. From enjoying their reasonably priced braai meat as a takeaway lunch option, to hosting intimate birthday dinners in their VIP room, they strive to create memorable moments for their patrons. The restaurant's decor team beautifully sets up the VIP room, allowing diners to enjoy a private ambiance while still faintly hearing the lively atmosphere of other guests. The food is known to be delicious and the staff is attentive and helpful."                                                         ,https://wanderlog.com/place/details/3192627/elahleni-food-and-braai
McDonald's Oxford Road Drive-Thru                              ,+27 43 722 1697 ,http://www.mcdonalds.co.za/                                                                                                                                                                ,         3.7 ,          2237 ,              3.7 ,               2237 ,#50 on            ,"#50 on""Where to eat: the 50 best restaurants in East London""" ,"AboutMcDonald's Oxford Road Drive-Thru is a renowned, time-honored fast-food franchise recognized for its delectable hamburgers and crispy fries. With an extensive history of operation, this iconic establishment has built a solid reputation among diners worldwide. Its menu showcases an array of savory options, including succulent beef patties nestled between soft buns, accompanied by perfectly seasoned deep-fried potato sticks."                                                                                                                                               ,https://wanderlog.com/place/details/3192657/mcdonalds-oxford-road-drive-thru
Quarry Lake Inn                                                ,+27 43 707 5400 ,https://quarrylakeinn.co.za/                                                                                                                                                               ,         4.6 ,           230 ,              4.6 ,                230 ,#25 on            ,"#25 on""Where to eat: the 50 best restaurants in East London""" ,"AboutQuarry Lake Inn is a laid-back guesthouse in East London, offering unfussy rooms with beautiful views of the former quarry and the surrounding greenery. The establishment provides an outdoor pool, sundeck, and gym for a tranquil stay. Guests have praised the helpful and caring staff, scrupulously clean rooms with clever design for unexpected but beautiful views. The inn is perfectly situated within trees and by a lake, providing spacious well-decorated clean rooms with ensuite bathrooms."                                                                             ,https://wanderlog.com/place/details/798614/quarry-lake-inn
Blue Sea Guest house                                           ,+27 83 440 2161 ,https://bluesealodge.co.za/                                                                                                                                                                ,         4.4 ,           115 ,              4.4 ,                115 ,#30 on            ,"#30 on""Where to eat: the 50 best restaurants in East London""" ,"AboutLocated in East London, Blue Sea Guest House is the perfect choice for families seeking a relaxing and enjoyable stay. The friendly host provides a comprehensive tour of all the facilities upon arrival. The rooms are comfortable and equipped with everything you need. A delectable breakfast, prepared by the hostess herself, can be enjoyed by guests. Safety is ensured with electric gates to protect vehicles, and there is also a pool and expansive lawn for children to play on."                                                                                           ,https://wanderlog.com/place/details/2318543/blue-sea-guest-house
RocoMamas Beacon Bay Crossing                                  ,+27 43 748 1596 ,https://www.rocomamas.com/za/find-a-restaurant/rocomamas-beacon-bay/?utm_source=google_maps&utm_medium=website_button&utm_campaign=SP&utm_content=SP                                       ,         4.3 ,          1499 ,              4.0 ,                 86 ,N/A               ,N/A                                                              ,"AboutRocoMamas Beacon Bay Crossing is a great hamburger restaurant in East London. The food was amazing and the service was excellent. Unfortunately, the waiter wasn't visible at our table, but overall it was a good experience."                                                                                                                                                                                                                                                                                                                                                           ,https://wanderlog.com/place/details/893405/rocomamas-beacon-bay-crossing
East London Museum                                             ,+27 43 743 0686 ,http://www.elmuseum.za.org/                                                                                                                                                                ,         4.4 ,           482 ,              4.0 ,                 73 ,#1 on             ,"#1 on""Top 50 things to do and attractions in East London"""    ,"AboutNestled at the northern end of Oxford Street, the East London Museum is a treasure trove for those intrigued by natural and cultural history. Established in 1921, this captivating museum showcases an array of exhibits that highlight the region's rich heritage. The star of the show is undoubtedly the coelacanth, a prehistoric fish thought to have been extinct for over 80 million years until its remarkable rediscovery in 1938 near East London."                                                                                                                            ,https://wanderlog.com/place/details/16895/east-london-museum
Friesland Milk Bar                                             ,+27 43 722 3260 ,https://m.facebook.com/FrieslandMilkBar/                                                                                                                                                   ,         4.5 ,          1463 ,              4.5 ,                111 ,#9 on             ,"#9 on""Top 50 things to do and attractions in East London"""    ,"AboutThis renowned milk bar in East London is well-known for its delectable ice cream and milkshakes, boasting a wide array of mouthwatering flavors and a variety of scrumptious sauces. With over 20 irresistible options to choose from, visitors can indulge in the sweeter side of the city. Whether you're craving a thick and creamy treat or simply looking to savor the best milkshake in South Africa, Friesland Milk Bar is a must-visit destination."                                                                                                                              ,https://wanderlog.com/place/details/3020207/friesland-milk-bar
"Areena Riverside Resort, Caravan Park & Private Game Reserve" ,+27 43 734 3055 ,http://www.areenaresort.com/                                                                                                                                                               ,         4.5 ,            37 ,              4.5 ,                 37 ,#10 on            ,"#10 on""Top 50 things to do and attractions in East London"""   ,"AboutAreena Riverside Resort Camping is a slice of paradise located on the Kwelera River in the Eastern Cape. The well-maintained camp offers clean ablution facilities and a restaurant, with the added bonus of being part of a game farm where you can spot impala, zebras, blesbuck, nyala, and giraffes."                                                                                                                                                                                                                                                                                 ,https://wanderlog.com/place/details/10192874/areena-riverside-resort-caravan-park--private-game-reserve
Hemingways Mall                                                ,+27 43 721 3180 ,https://www.hemingwaysmall.co.za/                                                                                                                                                          ,         4.3 ,          3335 ,              4.3 ,               3335 ,#18 on            ,"#18 on""Top 50 things to do and attractions in East London"""   ,"AboutHemingways Mall is a bustling shopping destination with over 160 stores, offering a wide range of stylish items for your home. The mall provides a perfect ambiance and features various entertainment options such as a 3D movie theatre, bowling alley, casino, and food court. Additionally, it serves as an excellent rainy day alternative to the beach with more than 200 shops and amenities like an amphitheater for fashion shows and music events."                                                                                                                             ,https://wanderlog.com/place/details/6173208/hemingways-mall
Gately House                                                   ,+27 43 731 1500 ,http://www.theheritageportal.co.za/thread/gately-house-east-london                                                                                                                         ,         5.0 ,             2 ,              5.0 ,                  2 ,#16 on            ,"#16 on""Top 50 things to do and attractions in East London"""   ,"AboutGately House, a colonial-style single-story building, stands as one of the oldest structures on the east bank of the Buffalo River. Constructed in 1876 for John Gately, a prominent figure in the city's history, this house served as a residence for his family until 1966. Following Gately's daughter's donation of its contents to preserve its historical significance, it now operates as the Gately House Historical Museum."                                                                                                                                                    ,https://wanderlog.com/place/details/561896/gately-house
East London City Hall                                          ,+27 43 705 1075 ,https://www.artefacts.co.za/main/Buildings/bldgframes.php?bldgid=2083                                                                                                                      ,         4.4 ,            28 ,              4.5 ,                  3 ,#23 on            ,"#23 on""Top 50 things to do and attractions in East London"""   ,"AboutEast London City Hall is a must-see attraction in the area, boasting an impressive and grand architectural design that dominates the cityscape. Built during Queen Victoria's diamond jubilee, it features the striking Victoria Tower as a tribute to her reign. The building stands as a symbol of English colonial rule in Africa during that era. Visitors can enjoy good food and beverages while taking in the stunning surroundings and excellent service at this beautiful venue."                                                                                                ,https://wanderlog.com/place/details/169566/east-london-city-hall
East London Golf Club                                          ,+27 43 735 1356 ,https://www.elgc.co.za/                                                                                                                                                                    ,         4.4 ,           748 ,              4.4 ,                748 ,#37 on            ,"#37 on""Top 50 things to do and attractions in East London"""   ,"AboutEast London Golf Club is a historic and top-rated course that has hosted numerous tournaments. The venue is known for its professional staff, excellent service, and stunning views. It offers a unique experience with resident impala roaming the grounds. The golf course is well-maintained with breathtaking holes and perfect greens. Additionally, it features great amenities such as a bar, restaurant, and conference center. Visitors can also enjoy encounters with local wildlife like monkeys and Springboks while appreciating the spacious surroundings."                 ,https://wanderlog.com/place/details/10398449/east-london-golf-club
Southern Cross Cruises                                         ,+27 73 257 2319 ,http://www.southerncrosscruises.co.za/                                                                                                                                                     ,         4.5 ,           159 ,              4.5 ,                159 ,#39 on            ,"#39 on""Top 50 things to do and attractions in East London"""   ,"AboutSouthern Cross Cruises is the first tour operator in East London to have a boat-based permit for whale and dolphin watching. Guests have enjoyed comfortable and smooth trips with friendly and knowledgeable skippers, observing bottlenose dolphins and learning about ocean life. Safety measures are diligently followed, ensuring a secure experience. Visitors also appreciate the opportunity to enjoy a seafood mix platter while watching the beautiful sunset."                                                                                                                 ,https://wanderlog.com/place/details/10525554/southern-cross-cruises
Marlene Neumann Exclusive Fine Art Photography                 ,+27 83 321 3391 ,http://www.marleneneumann.com/                                                                                                                                                             ,         4.7 ,            33 ,              5.0 ,                 11 ,N/A               ,N/A                                                              ,Why you should go1Explore a tranquil and serene gallery hidden in suburbia2Admire beautiful artworks by talented photographer Marlene Neumann3Experience the stunning garden surrounding the gallery                                                                                                                                                                                                                                                                                                                                                                                            ,https://wanderlog.com/place/details/16898/marlene-neumann-exclusive-fine-art-photography
The Kitchen Table East London                                  ,+27 64 313 7441 ,https://www.facebook.com/thekitchentableel                                                                                                                                                 ,         4.6 ,           139 ,              4.6 ,                139 ,#26 on            ,"#26 on""The 50 best spots for lunch in East London"""           ,"AboutThe Kitchen Table East London is a popular dining spot with a variety of reviews. While Pinky Kitchen leads in ratings, it has fewer reviews compared to Jade Garden Fusion Restaurant, which has a slightly lower rating but more reviews. Visitors have enjoyed spectacular 4-course meals at The Kitchen Table East London, praising the flavors and pairings of each dish. Some have experienced excellent breakfasts despite minor issues like overcooked bacon, attributing it to possible kitchen staff changes."                                                                  ,https://wanderlog.com/place/details/9989202/the-kitchen-table-east-london
Wykato Spur                                                    ,+27 43 748 2011 ,https://www.spursteakranches.com/za/restaurant/wykato-spur?utm_source=google_maps&utm_medium=website_button&utm_campaign=SP&utm_content=SP                                                 ,         4.1 ,          1421 ,              3.0 ,                 37 ,N/A               ,N/A                                                              ,"AboutWykato Spur Steak Ranch is a family-friendly restaurant chain known for its delicious steaks, burgers, ribs, and wings. The establishment has received praise for its excellent breakfast options and attentive service. Guests have enjoyed the lively atmosphere at Wykato Spur Steak Ranch, often featuring singing and birthday celebrations. The restaurant is popular among families due to its fun environment for kids and friendly staff."                                                                                                                                       ,https://wanderlog.com/place/details/2903008/wykato-spur
