Name                                    ,Google Stars ,Google Reviews ,TripAdvisor Stars ,TripAdvisor Reviews ,Wanderlog Ranking ,Wanderlog List                                                   ,About                                                                                                                                                                                                                                                                                                                                                                                                                                                                                                                                                                                       ,Address                                                                                                                                                                                    ,Phone           ,Website ,Link
Wimpy                                   ,         4.2 ,          1664 ,              4.0 ,                 30 ,#32 on            ,"#32 on""Where to eat: the 50 best restaurants in East London""" ,"AboutWimpy is a well-established casual dining spot known for its selection of burgers, mixed grills, and other classic comfort dishes. Situated by the ocean, it offers a serene atmosphere with a refreshing sea breeze. Visitors have praised the friendly staff who go out of their way to assist guests, such as providing access to WiFi for booking transportation. The eatery is lauded for its great service and delicious food, making it an ideal spot for a satisfying breakfast or a filling meal."                                                                           ,https://location.wimpy.co.za/east-london-esplanade?y_source=1_MTIzNjA3MTctNzE1LWxvY2F0aW9uLndlYnNpdGU%3D                                                                                   ,+27 43 722 2898 ,N/A     ,https://wanderlog.com/place/details/2801866/wimpy
Panarottis Hemingways                   ,         4.0 ,           335 ,              3.5 ,                 23 ,#40 on            ,"#40 on""Where to eat: the 50 best restaurants in East London""" ,"AboutPanarottis Hemingways is an Italian restaurant located at Hemingways. It offers a wide variety of delicious pizza and pasta made from high-quality ingredients. The restaurant provides a family-friendly environment with an awesome kiddies area where kids can build their own pizzas and decorate their own waffles. The service is known for being friendly and accommodating, making every visitor feel comfortable."                                                                                                                                                           ,https://www.panarottis.com/za/restaurants/eastern-cape/panarottis-hemingways/?utm_source=google_maps&utm_medium=website_button&utm_campaign=SP&utm_content=SP                              ,+27 43 726 2014 ,N/A     ,https://wanderlog.com/place/details/2943439/panarottis-hemingways
La Cuisinette                           ,         4.5 ,           131 ,              4.5 ,                 17 ,#43 on            ,"#43 on""Where to eat: the 50 best restaurants in East London""" ,"AboutThe new location of La Cuisinette is smaller, but it offers a more intimate atmosphere. They were the only ones booked on that particular night, which allowed for excellent service. The food was exquisite, ranging from delicious steak to flavorful tongue. It would have been nice if they had something special for the birthday girl in our group, as this could potentially attract more people to celebrate their birthdays at the restaurant."                                                                                                                              ,http://www.lacuisinette.co.za/                                                                                                                                                             ,+27 43 748 3964 ,N/A     ,https://wanderlog.com/place/details/3001073/la-cuisinette
Ciao Bella Cafe & Pizzeria              ,         4.6 ,           296 ,              4.5 ,                 16 ,#27 on            ,"#27 on""Where to eat: the 50 best restaurants in East London""" ,"AboutNestled along Old Transkei Road in Nahoon, Ciao Bella Cafe & Pizzeria is a delightful haven for lovers of authentic Italian cuisine. This charming spot specializes in mouthwatering pizzas, delectable pasta dishes, and scrumptious paninis that are sure to satisfy any craving. Open throughout the week with varying hours, it’s an ideal place for breakfast or a cozy dinner. During my recent visit while passing through town, I stumbled upon this little gem after a quick online search."                                                                                 ,http://www.ciaobellacafe.co.za/                                                                                                                                                            ,+27 43 735 1542 ,N/A     ,https://wanderlog.com/place/details/893402/ciao-bella-cafe--pizzeria
Brazas Portuguese Fusion                ,         4.8 ,           162 ,              5.0 ,                 15 ,#48 on            ,"#48 on""Where to eat: the 50 best restaurants in East London""" ,"AboutBrazas Portuguese Fusion in East London is making a mark with its unique and vibrant flair, embodying the motto ""Mi Casa Su Casa"" to create a welcoming and homely atmosphere. The restaurant boasts a cozy ambiance with personalized decor and soft lighting, setting the stage for an exceptional dining experience. Blending traditional Portuguese flavors with innovative twists, Brazas offers a delightful and unforgettable culinary journey."                                                                                                                             ,http://www.brazas.co.za/                                                                                                                                                                   ,+27 73 853 9115 ,N/A     ,https://wanderlog.com/place/details/3192635/brazas-portuguese-fusion
Areena Quays Restaurant                 ,         4.2 ,           532 ,              3.5 ,                 14 ,#45 on            ,"#45 on""Where to eat: the 50 best restaurants in East London""" ,"AboutAreena Quays Restaurant is a family-friendly dining spot with a tranquil environment and plenty of activities for kids. The restaurant offers delicious food and fantastic service, making it an ideal place for a special celebration or a relaxing meal. With its stunning views and serene ambience, Areena Quays Restaurant is the perfect destination for those looking to enjoy an ""All you can eat"" experience while surrounded by nature."                                                                                                                                  ,http://www.areenaresort.com/                                                                                                                                                               ,+27 71 720 5867 ,N/A     ,https://wanderlog.com/place/details/3001098/areena-quays-restaurant
Jade Garden Fusion Restaurant           ,         4.8 ,           104 ,              5.0 ,                 12 ,#36 on            ,"#36 on""Where to eat: the 50 best restaurants in East London""" ,"AboutJade Garden Fusion Restaurant is a top-rated spot in East London, offering a pleasant and beautiful setting with comfortable seating. The restaurant is known for its marvelous food, and the staff provides great service, making it a rare find in the area. Visitors praise the cleanliness, newness, and appealing decor of the restaurant. The menu features a variety of Chinese dishes that have impressed even those who were previously not fans of certain flavors. Customers can enjoy dine-in or take advantage of the convenient takeaway service."                      ,https://www.facebook.com/jadegardenfusionrestaurant/                                                                                                                                       ,+27 63 451 3912 ,N/A     ,https://wanderlog.com/place/details/2801923/jade-garden-fusion-restaurant
Key Largo                               ,         4.3 ,            42 ,              3.5 ,                 10 ,#28 on            ,"#28 on""Where to eat: the 50 best restaurants in East London""" ,"AboutKey Largo, located at Hemingways Hotel, offers a diverse selection of dishes from the grill buffet and a la carte menu. The restaurant boasts stunning views of the beautiful gardens and is open for breakfast, lunch, and dinner. Guests have praised the exquisite food and excellent service, making it an unforgettable dining experience. The buffet on Friday nights is particularly popular for its delicious offerings. Chef Shaun Gibb's culinary skills have been highlighted as exceptional, adding to the restaurant's appeal."                                          ,https://www.southernsun.com/southern-sun-hemingways/dining/key-largo?utm_source=google&utm_medium=businesslisting&utm_campaign=rstrnt_key-largo                                            ,+27 43 707 7985 ,N/A     ,https://wanderlog.com/place/details/893406/key-largo
Elahleni Food and Braai                 ,         4.3 ,           304 ,              4.0 ,                  1 ,#47 on            ,"#47 on""Where to eat: the 50 best restaurants in East London""" ,"AboutElahleni Food and Braai offers a variety of experiences to its customers. From enjoying their reasonably priced braai meat as a takeaway lunch option, to hosting intimate birthday dinners in their VIP room, they strive to create memorable moments for their patrons. The restaurant's decor team beautifully sets up the VIP room, allowing diners to enjoy a private ambiance while still faintly hearing the lively atmosphere of other guests. The food is known to be delicious and the staff is attentive and helpful."                                                     ,https://elahleni.co.za/                                                                                                                                                                    ,+27 78 726 8835 ,N/A     ,https://wanderlog.com/place/details/3192627/elahleni-food-and-braai
McDonald's Oxford Road Drive-Thru       ,         3.7 ,          2237 ,              3.7 ,               2237 ,#50 on            ,"#50 on""Where to eat: the 50 best restaurants in East London""" ,"AboutMcDonald's Oxford Road Drive-Thru is a renowned, time-honored fast-food franchise recognized for its delectable hamburgers and crispy fries. With an extensive history of operation, this iconic establishment has built a solid reputation among diners worldwide. Its menu showcases an array of savory options, including succulent beef patties nestled between soft buns, accompanied by perfectly seasoned deep-fried potato sticks."                                                                                                                                           ,http://www.mcdonalds.co.za/                                                                                                                                                                ,+27 43 722 1697 ,N/A     ,https://wanderlog.com/place/details/3192657/mcdonalds-oxford-road-drive-thru
Quarry Lake Inn                         ,         4.6 ,           230 ,              4.6 ,                230 ,#25 on            ,"#25 on""Where to eat: the 50 best restaurants in East London""" ,"AboutQuarry Lake Inn is a laid-back guesthouse in East London, offering unfussy rooms with beautiful views of the former quarry and the surrounding greenery. The establishment provides an outdoor pool, sundeck, and gym for a tranquil stay. Guests have praised the helpful and caring staff, scrupulously clean rooms with clever design for unexpected but beautiful views. The inn is perfectly situated within trees and by a lake, providing spacious well-decorated clean rooms with ensuite bathrooms."                                                                         ,https://quarrylakeinn.co.za/                                                                                                                                                               ,+27 43 707 5400 ,N/A     ,https://wanderlog.com/place/details/798614/quarry-lake-inn
Blue Sea Guest house                    ,         4.4 ,           115 ,              4.4 ,                115 ,#30 on            ,"#30 on""Where to eat: the 50 best restaurants in East London""" ,"AboutLocated in East London, Blue Sea Guest House is the perfect choice for families seeking a relaxing and enjoyable stay. The friendly host provides a comprehensive tour of all the facilities upon arrival. The rooms are comfortable and equipped with everything you need. A delectable breakfast, prepared by the hostess herself, can be enjoyed by guests. Safety is ensured with electric gates to protect vehicles, and there is also a pool and expansive lawn for children to play on."                                                                                       ,https://bluesealodge.co.za/                                                                                                                                                                ,+27 83 440 2161 ,N/A     ,https://wanderlog.com/place/details/2318543/blue-sea-guest-house
RocoMamas Beacon Bay Crossing           ,         4.3 ,          1499 ,              4.0 ,                 86 ,N/A               ,N/A                                                              ,"AboutRocoMamas Beacon Bay Crossing is a great hamburger restaurant in East London. The food was amazing and the service was excellent. Unfortunately, the waiter wasn't visible at our table, but overall it was a good experience."                                                                                                                                                                                                                                                                                                                                                       ,https://www.rocomamas.com/za/find-a-restaurant/rocomamas-beacon-bay/?utm_source=google_maps&utm_medium=website_button&utm_campaign=SP&utm_content=SP                                       ,+27 43 748 1596 ,N/A     ,https://wanderlog.com/place/details/893405/rocomamas-beacon-bay-crossing
