Name                                    ,Google Stars ,Google Reviews ,TripAdvisor Stars ,TripAdvisor Reviews ,Wanderlog Ranking ,Wanderlog List                                                   ,About                                                                                                                                                                                                                                                                                                                                                                                                                                                                                                                                                                                       ,Address                                                                                                                                                                                    ,Phone           ,Website ,Link
Grazia Fine Food & Wine                 ,         4.5 ,          1880 ,              4.5 ,                645 ,#1 on             ,"#1 on""Where to eat: the 50 best restaurants in Eastern Cape""" ,"AboutGrazia Fine Food & Wine is a Mediterranean restaurant in East London with outdoor seating and parking available. The menu includes Italian dishes such as seafood and pasta, European favourites like shepherd's pie, and international favourites like buffalo chicken wrap. The restaurant also has a full bar serving wine and beer, and accepts American Express, Mastercard, and Visa."                                                                                                                                                                                          ,http://www.graziafinefood.co.za/                                                                                                                                                           ,+27 87 350 4066 ,N/A     ,https://wanderlog.com/place/details/893386/grazia-fine-food--wine
"Lavender Blue Market, Café & Deli"     ,         4.5 ,          1419 ,              4.5 ,                266 ,#4 on             ,"#4 on""Where to eat: the 50 best restaurants in East London"""  ,"AboutLavender Blue Market, Café & Deli is a must-visit spot in the Eastern Cape, particularly if you're traveling on Route 72 between East London and Port Elizabeth. This family-friendly destination offers a delightful atmosphere with ample space for children to play while you enjoy delicious eats and drinks. The market features a variety of offerings including fresh produce, delectable sauces, sweets, and gifts. Additionally, there's a shop with beautiful clothes and more gifts to explore."                                                                           ,https://lavenderbluemarket.co.za/                                                                                                                                                          ,+27 43 732 1172 ,N/A     ,https://wanderlog.com/place/details/2902979/lavender-blue-market-café--deli
THE BEACH BREAK                         ,         4.5 ,          1080 ,              4.5 ,                 58 ,#3 on             ,"#3 on""Where to eat: the 50 best restaurants in East London"""  ,"AboutNestled in a serene environment, The Beach Break Cafe is a beloved spot for both locals and visitors seeking a delightful dining experience. Renowned for its exceptional coffee, light lunches, hearty breakfasts, and delectable cakes, this family-friendly cafe offers an array of healthy options like chicken wraps and scrumptious carrot cake. Guests can unwind under the trees while savoring their meals in a peaceful atmosphere that encourages relaxation."                                                                                                             ,https://www.facebook.com/nahoonbreak/                                                                                                                                                      ,+27 78 171 2579 ,N/A     ,https://wanderlog.com/place/details/2801883/the-beach-break
Emerald Vale Brewery                    ,         4.6 ,           804 ,              4.0 ,                 52 ,#1 on             ,"#1 on""Where to eat: the 50 best restaurants in East London"""  ,"AboutNestled in the picturesque Cintsa East, just a short drive from East London, Emerald Vale Brewery is a charming family-owned establishment offering stunning views of the Eastern Cape's verdant landscapes. The brewery boasts a play area for children and serves up delectable pub-style dishes alongside their craft beers, all made with fresh rainwater. Whether you prefer Pale, Gold, Amber or Dark Ale, there's something to suit every beer enthusiast's palate."                                                                                                           ,http://www.emeraldvale.co.za/                                                                                                                                                              ,+27 43 738 5397 ,N/A     ,https://wanderlog.com/place/details/233652/emerald-vale-brewery
"Sanook Cafe, East London"              ,         4.6 ,          1806 ,              4.5 ,                564 ,#2 on             ,"#2 on""Where to eat: the 50 best restaurants in Eastern Cape""" ,"AboutSanook Cafe is a restaurant located in Berea, East London. The cafe serves Italian, American, pizza and vegetarian friendly dishes. The cafe has outdoor seating and also offers table service."                                                                                                                                                                                                                                                                                                                                                                                      ,http://www.sanook.co.za/                                                                                                                                                                   ,+27 43 721 3215 ,N/A     ,https://wanderlog.com/place/details/63711/sanook-cafe-east-london
Ocean Basket East London                ,         4.1 ,          1166 ,              4.0 ,                244 ,#7 on             ,"#7 on""Where to eat: the 50 best restaurants in East London"""  ,"AboutOcean Basket East London is a popular seafood restaurant located in Port Elizabeth, Nelson Mandela Bay, Eastern Cape, South Africa. It offers a cheerful atmosphere and serves a variety of seafood dishes and sharing platters. Visitors have enjoyed celebrating special occasions at the restaurant and noted that it caters to groups with diverse preferences. While some mentioned minor inconveniences like leaking roofs during rainy weather, the overall consensus is that Ocean Basket East London provides great food and an enjoyable dining experience."                ,https://oceanbasket.co.za/?utm_source=google_maps&utm_medium=website_button&utm_campaign=SP&utm_content=SP                                                                                 ,+27 43 727 5018 ,N/A     ,https://wanderlog.com/place/details/893394/ocean-basket-east-london
Café Neo                                ,         4.3 ,          1248 ,              4.0 ,                156 ,#11 on            ,"#11 on""Where to eat: the 50 best restaurants in East London""" ,"AboutCafé Neo is a charming eatery that stands out for its diverse menu and inviting ambiance, making it an ideal spot for casual dining and intimate gatherings. With a delightful selection of dishes ranging from Mediterranean-inspired breakfasts to hearty lunches and dinners, this café caters to all tastes. Guests rave about the top-notch cocktails crafted from premium ingredients, alongside mouthwatering options like pasta, burgers, oxtail with veggies, and seafood delights. The attentive staff ensures a warm welcome and excellent service throughout your visit." ,https://www.dining-out.co.za/md-menu/Cafe-Neo-East-London/4743                                                                                                                             ,+27 43 722 4531 ,N/A     ,https://wanderlog.com/place/details/2801908/café-neo
Cantina and Craft                       ,         4.6 ,           156 ,              4.5 ,                126 ,#10 on            ,"#10 on""Where to eat: the 50 best restaurants in East London""" ,"AboutNestled in The Crossing of Beacon Bay, Cantina & Craft is a vibrant Mexican-themed restaurant that promises an unforgettable dining experience for the whole family. With a delightful kids' menu featuring fun options like Corn on the Cob, Cheesy Nachos with Chicken, and Mini Burritos with Mac and Cheese, even picky eaters will find something to enjoy. The stylish yet relaxed ambiance creates a welcoming atmosphere complemented by friendly service."                                                                                                                   ,https://www.sanook.co.za/cantina/                                                                                                                                                          ,+27 43 748 2636 ,N/A     ,https://wanderlog.com/place/details/2801860/cantina-and-craft
The Cow and Milk Shed                   ,         4.4 ,           930 ,              4.0 ,                 89 ,#6 on             ,"#6 on""Where to eat: the 50 best restaurants in East London"""  ,"AboutThe Cow and Milk Shed is a cozy eatery that offers reinvented comfort food in a pleasant atmosphere. The menu features dishes like Wiltshire pork sausage on mash with onion gravy and creamy salmon-and-pea risotto, all beautifully presented. However, the highlight is their dry-aged steaks served with flavorful sauces. Whether you choose to dine at the bar or restaurant side, you can expect generous serving sizes and attentive service."                                                                                                                                ,https://www.facebook.com/thecowandmilkshed/                                                                                                                                                ,+27 43 735 1513 ,N/A     ,https://wanderlog.com/place/details/893392/the-cow-and-milk-shed
Jules On Jarvis                         ,         4.5 ,          1288 ,              5.0 ,                 75 ,#9 on             ,"#9 on""Where to eat: the 50 best restaurants in East London"""  ,"AboutNestled in the heart of East London, Jules on Jarvis is a delightful bistro and coffee shop that emphasizes fresh, local ingredients to create honest and delectable meals. With an inviting atmosphere perfect for enjoying breakfast, lunch, or dinner, this charming spot features a menu that includes gourmet pizzas and tempting homemade treats. The culinary expertise of two Cordon-bleu chefs ensures every dish is crafted with care."                                                                                                                                     ,https://julesonjarvis.co.za/                                                                                                                                                               ,+27 73 528 4033 ,N/A     ,https://wanderlog.com/place/details/2801853/jules-on-jarvis
The Grillroom                           ,         4.1 ,            37 ,              3.5 ,                  5 ,#12 on            ,"#12 on""Where to eat: the 50 best restaurants in East London""" ,"AboutThe Grillroom is an upscale beachfront steakhouse offering a diverse range of reasonably priced, high-quality meals. Its extensive wine and beverage selection perfectly complements the menu. The interior is stunningly beautiful, immaculately clean, and boasts friendly service. The steaks are of exceptional quality and are presented with exquisite taste. The atmosphere is warm, cozy, making it suitable for intimate dinners or year-end team functions."                                                                                                                ,https://thegrillroom.co.za/                                                                                                                                                                ,+27 43 709 5018 ,N/A     ,https://wanderlog.com/place/details/3192615/the-grillroom
Sanook Eatery                           ,         4.5 ,          2312 ,              4.5 ,                243 ,#5 on             ,"#5 on""Where to eat: the 50 best restaurants in Eastern Cape""" ,"AboutNestled away from the hustle and bustle of city life, Sanook Eatery is a delightful addition to East London's dining scene. This charming venue offers a warm and cozy atmosphere, making it an ideal spot for families with older children or anyone looking to enjoy a meal in comfort. The menu boasts an impressive array of options, from mouthwatering pizzas and gourmet burgers to more refined dishes like dukkah-crusted fillet and biltong-spiced sirloin steak."                                                                                                          ,http://www.sanook.co.za/                                                                                                                                                                   ,+27 43 748 2494 ,N/A     ,https://wanderlog.com/place/details/893400/sanook-eatery
The Cricketer                           ,         4.7 ,           332 ,              4.5 ,                 98 ,#14 on            ,"#14 on""Where to eat: the 50 best restaurants in East London""" ,"AboutThe Cricketer, located approximately 17 kilometers outside of East London, is a beloved dining spot known for its top-notch steaks and warm atmosphere. The restaurant exudes a cozy and rustic charm, offering a homely yet elegant setting for patrons to enjoy quality food and attentive service. Visitors praise the delicious steaks, particularly the rump steak, as well as other menu items like Springbok carpaccio. Guests also appreciate the affordable breakfast options and friendly staff."                                                                           ,http://www.2swans.co.za/restaurant/                                                                                                                                                        ,+27 83 659 8899 ,N/A     ,https://wanderlog.com/place/details/893388/the-cricketer
The Reef Café                           ,         4.3 ,           529 ,              4.0 ,                 42 ,#21 on            ,"#21 on""Where to eat: the 50 best restaurants in East London""" ,"AboutThe Reef Café, located in a beautiful and peaceful setting, offers more than just delicious food and a welcoming atmosphere. Visitors can take advantage of a special offer that includes a free coffee for those who use provided plastic bags to pick up garbage on the beaches. The manager is known for being hands-on, ensuring high standards in both food and service. Additionally, the café's location provides access to scenic walks through nature reserves with stunning views of sand dunes and the sea."                                                               ,https://www.facebook.com/thereefcafeEL/?view_public_for=182132651930649                                                                                                                    ,+27 83 419 3056 ,N/A     ,https://wanderlog.com/place/details/2802072/the-reef-café
Silver Eagle Spur Steak Ranch           ,         4.2 ,          1936 ,              4.0 ,                 37 ,#20 on            ,"#20 on""Where to eat: the 50 best restaurants in East London""" ,"AboutThe Silver Eagle Spur Steak Ranch is a family-friendly restaurant with excellent service, that dishes up steaks, burgers, ribs and wings. It's a great place to go for a meal or takeout, and they accept American Express, Mastercard and Visa. Free wifi is available as well as delivery."                                                                                                                                                                                                                                                                                         ,https://www.spursteakranches.com/za/restaurant/silver-eagle-spur?utm_source=google_maps&utm_medium=website_button&utm_campaign=SP&utm_content=SP                                           ,+27 43 721 0995 ,N/A     ,https://wanderlog.com/place/details/2801907/silver-eagle-spur-steak-ranch
Ginger & Co                             ,         4.6 ,           535 ,              4.5 ,                 29 ,#18 on            ,"#18 on""Where to eat: the 50 best restaurants in East London""" ,"AboutGinger & Co is a well-established fine-dining restaurant located in Gqeberha's Beach Hotel, offering stylish dining with sea views. The menu features contemporary dishes with local flair, including an impressive selection of seafood, steaks, and game meats. The restaurant prides itself on serving meals made with love and passion, providing diners with a memorable culinary experience."                                                                                                                                                                                   ,https://www.facebook.com/gingerfood/                                                                                                                                                       ,+27 82 870 0144 ,N/A     ,https://wanderlog.com/place/details/2801894/ginger--co
John Dory's Hemingways Mall             ,         3.7 ,            65 ,              1.0 ,                  2 ,#23 on            ,"#23 on""Where to eat: the 50 best restaurants in East London""" ,"AboutJohn Dory's Hemingways Mall offers a delightful dining experience with a variety of menu options to choose from. Guests can enjoy a romantic dinner with excellent food and hospitable hosts. The Maritime platter special is highly recommended, along with the delicious sushi and refreshing Pina colada. The attentive service adds to the overall enjoyable visit at this restaurant."                                                                                                                                                                                           ,https://www.johndorys.com/za/find-a-restaurant/eastern-cape/cambridge-village/john-dory's-hemingways-mall/?utm_source=google_maps&utm_medium=website_button&utm_campaign=SP&utm_content=SP ,+27 43 753 0073 ,N/A     ,https://wanderlog.com/place/details/7694484/john-dorys-hemingways-mall
Irana Indian Restaurant                 ,         4.4 ,           258 ,              4.5 ,                212 ,#31 on            ,"#31 on""Where to eat: the 50 best restaurants in East London""" ,"AboutWhen an elderly man had a vision and ran out of time, someone stepped up to fulfill his dream. Having worked as a chef for 45 years, IRANA Gooranah dedicated himself to the culinary industry, honing his skills day after day. Nestled in a small corner, Irana Indian Restaurant offers delectable Indian cuisine with a touch of elegance."                                                                                                                                                                                                                                       ,https://www.facebook.com/iranarestaurant/                                                                                                                                                  ,+27 43 721 2231 ,N/A     ,https://wanderlog.com/place/details/2801849/irana-indian-restaurant
Windmill Roadhouse                      ,         4.4 ,          6065 ,              4.0 ,                202 ,#33 on            ,"#33 on""Where to eat: the 50 best restaurants in East London""" ,"AboutThe Windmill Roadhouse is a restaurant with a wide menu that includes breakfast, lunch and dinner. The food was good, and the milkshakes were popular. There is a lot of parking available, and service was excellent. The atmosphere was even better."                                                                                                                                                                                                                                                                                                                               ,https://www.windmillroadhouse.co.za/                                                                                                                                                       ,+27 43 722 9208 ,N/A     ,https://wanderlog.com/place/details/2801878/windmill-roadhouse
Mugg & Bean                             ,         4.0 ,           949 ,              3.5 ,                142 ,#38 on            ,"#38 on""Where to eat: the 50 best restaurants in East London""" ,"AboutMugg & Bean is a modern chain cafe known for its hearty classics, gourmet burgers, sandwiches, and giant muffins. The restaurant offers a variety of breakfast and brunch options such as Omelettes, Eggs Benedict choices including unique options like Buffalo Chicken & Blue Cheese Eggs Benedict. With locations at Vincent Park Shopping Centre, Hemingways Mall, and East London Airport, Mugg & Bean provides a relaxed and cozy atmosphere suitable for family dinners, business lunches or catching up with friends."                                                        ,https://location.muggandbean.co.za/east-london-vincent-park?y_source=1_MTI0NDAzNjItNzE1LWxvY2F0aW9uLndlYnNpdGU%3D                                                                          ,+27 43 726 5898 ,N/A     ,https://wanderlog.com/place/details/2801940/mugg--bean
Shanghai Chinese Restaurant & Sushi Bar ,         4.2 ,           707 ,              4.0 ,                107 ,#35 on            ,"#35 on""Where to eat: the 50 best restaurants in East London""" ,"AboutShanghai Chinese Restaurant & Sushi Bar has two locations in Beacon Bay and Quigney, offering delicious Cantonese cuisine and sushi at great value. The restaurant is known for its authentic Shanghai dishes like brinjal fritters, sizzling lamb, and chicken with cashew nuts. Special occasions can be celebrated with a pre-ordered Peking duck with plum sauce. The atmosphere may feel a bit cold, but the friendly and helpful waitstaff make up for it."                                                                                                                     ,https://www.shanghairestaurant.co.za/                                                                                                                                                      ,+27 43 748 2998 ,N/A     ,https://wanderlog.com/place/details/2801896/shanghai-chinese-restaurant--sushi-bar
Heavenly Pancake House                  ,         4.2 ,          1482 ,              3.5 ,                 71 ,#34 on            ,"#34 on""Where to eat: the 50 best restaurants in East London""" ,"AboutHeavenly Pancake House in Gonubie is a charming beachfront venue that specializes in savory and sweet pancakes. The restaurant offers fresh, high-quality dishes with friendly and attentive staff. Guests can enjoy the stunning ocean views while sipping on cappuccinos and indulging in delicious pancakes. Although parking may be limited, the overall experience of dining at this establishment is delightful, with many visitors praising the excellent service and breathtaking sea view."                                                                                  ,http://www.bestcoffeeshops.co.za/pancake-house-gonubie.html                                                                                                                                ,+27 43 740 5273 ,N/A     ,https://wanderlog.com/place/details/2801889/heavenly-pancake-house
Table 58 Brewing                        ,         4.5 ,          1350 ,              4.5 ,                 39 ,#37 on            ,"#37 on""Where to eat: the 50 best restaurants in East London""" ,"AboutTable 58 Brewing is a charming craft brewery located within the beautiful gardens of the Floradale Garden Centre in Beacon Bay. It has become a popular spot for both locals and tourists, offering an array of craft beers, a value-for-money menu, and a spacious outdoor deck with local entertainment. The atmosphere is welcoming and vibrant, with special offers like buy-one-get-one-free burgers on Tuesdays. The large beer garden creates an outdoor feel while maintaining comfort among the trees."                                                                      ,http://www.table58brewing.co.za/                                                                                                                                                           ,+27 43 748 2815 ,N/A     ,https://wanderlog.com/place/details/2801934/table-58-brewing
